[
  {
    "id": "c29e1c87-c093-4cd7-b6c7-5a1dfddcacda",
    "title": "Ndalimi i TikTok-ut",
    "statement": "A duhet Shqiëpria të vazhdojë me ndalimin e rrjetit social TikTok?",
    "detail": "",
    "tags": []
  },
  {
    "id": "bee382c9-cc9f-42ee-9c78-219c99b6834d",
    "title": "Orari 7-Orësh",
    "statement": "A duhet Shqiëpria të adoptojë orarin zyrtar të punës me 7 orë punë në ditë (09:00 – 16:00)?",
    "detail": "",
    "tags": []
  },
  {
    "id": "66066811-fde6-4655-bb57-ade9f6f87360",
    "title": "Drekë Falas për Nxënësit",
    "statement": "A duhet Shqipëria të ofrojë drekën falas për nxënësit në shkolla?",
    "detail": "",
    "tags": []
  },
  {
    "id": "5d0713c6-8885-4a17-a250-45c5af67505d",
    "title": "Taksë e Sheshtë",
    "statement": "A duhet që Shqipëria të vendosi taksën e sheshtë ndaj të ardhurave?",
    "detail": "",
    "tags": []
  },
  {
    "id": "e2434058-469f-4c56-8f2a-83532d0133e5",
    "title": "Taksimi ndaj të Pasurve",
    "statement": "A duhet që Shqipëria të rrisë nivelin e taksimit ndaj të pasurve?",
    "detail": "",
    "tags": []
  },
  {
    "id": "ce628994-51c5-45e8-934d-c858e202bf10",
    "title": "Formula për Pensionet",
    "statement": "A duhet Shqipëria të përcaktojë një formulë për rritjen e pensioneve?",
    "detail": "",
    "tags": []
  },
  {
    "id": "c04416be-daf6-4c45-9cb0-46a09dd6522c",
    "title": "Kartë Konsumatori",
    "statement": "A duhet Shqipëria të krijojë një kartë konsumatori për shtresat vulnerabël?",
    "detail": "",
    "tags": []
  },
  {
    "id": "2ae28d53-1cb6-4c25-afe3-1d73bf8f4587",
    "title": "Kredi për të Rinj",
    "statement": "A duhet Shqipëria të ofrojë kredi të buta për banesë dhe biznes të vogël për të rinjtë nën 30 vjeç?",
    "detail": "",
    "tags": []
  },
  {
    "id": "e7f4de84-21f1-41b6-9812-8e250450b876",
    "title": "Rivlerësimi i Kontratave PPP",
    "statement": "A duhet Shqipëria të bëjë një rivlerësim të të gjitha kontratave publiek të dhëna me partneritet public-privat?",
    "detail": "",
    "tags": []
  },
  {
    "id": "4631a215-6b77-4ee9-a498-1aad8177de65",
    "title": "Ndalimi i Offshore në Tendera",
    "statement": "A duhet Shqipëria të ndalojë pjesëmarrjen e kompanive offshore me pronarë të fshehur në tendera publikë?",
    "detail": "",
    "tags": []
  },
  {
    "id": "554ae22a-7cc3-40d6-a549-5bc1c2d169f1",
    "title": "AI në Prokurimet Publike",
    "statement": "A duhet Shqipëria të përfshijë Inteligjencën Artificiale për prokurimet publike?",
    "detail": "",
    "tags": []
  },
  {
    "id": "3381db85-bf39-4b03-890c-9552615c03d6",
    "title": "Rikonceptimi i Hartës Gjyqësore",
    "statement": "A duhet Shqipëria të rikonceptojë hartën gjyqësore?",
    "detail": "",
    "tags": []
  },
  {
    "id": "4ce76259-cf60-46fa-af34-aac4d79c416c",
    "title": "Fund Ligjit të Investimeve Strategjike",
    "statement": "A duhet Shqipëria t’i japë fund ligjit të investimeve strategjike?",
    "detail": "",
    "tags": []
  },
  {
    "id": "9a96cf86-a8ac-4394-981f-4a83268f8696",
    "title": "Rindërtimi i Rafinerisë",
    "statement": "A duhet Shqipëria të rindërtojë nëj rafineri për përpunimin e naftës që del nga nëntoka Shqipëtare?",
    "detail": "",
    "tags": []
  },
  {
    "id": "4ec6a812-b8c9-4c68-8ed1-fe100c5ea0f6",
    "title": "Subvencione për Fermerët",
    "statement": "A duhet Shqipëria të parashikojë 100 milionë euro subvencione në vit për fermerët dhe 50 milionë euro për infrastrukturë agrokulturore?",
    "detail": "",
    "tags": []
  },
  {
    "id": "952a010e-d053-4e6c-af25-96afbc03147e",
    "title": "Taksë për Apartamentet e Shumta",
    "statement": "A duhet Shqipëria të vendosë taksë progressive për pronësinë e apartamenteve të treta, të katërta e kështu me rradhë?",
    "detail": "",
    "tags": []
  },
  {
    "id": "340a8a26-e72d-437b-8eea-cac27102c710",
    "title": "Çmim i Diferencuar i Energjisë",
    "statement": "A duhet Shqipëria të përdorë fasha të ndryshme të ccmimit të energjisë bazuar ën konsum?",
    "detail": "",
    "tags": []
  },
  {
    "id": "bc6b1115-d6b7-4bb8-b4da-e7d5682697dd",
    "title": "Ndalimi i Monopolit Mediatik",
    "statement": "A duhet Shqipëria të ndalojë pronësinë 100% të mediave nga një person apo famile?",
    "detail": "",
    "tags": []
  },
  {
    "id": "9895b179-f59a-4c31-bf23-63a68d9ffbea",
    "title": "Arsim Falas deri në Master",
    "statement": "A duhet Shqipëria të ofrojë arsim falas deri në nivelin master?",
    "detail": "",
    "tags": []
  },
  {
    "id": "c1c11b6f-6257-40f5-adc0-c5717d6a9896",
    "title": "Rritja e Pagës së Mësuesve",
    "statement": "A duhet Shqipëria të rrisë me 25% pagën e mësuesve ccdo vit për 4 vite rradhazi?",
    "detail": "",
    "tags": []
  },
  {
    "id": "ce10c562-f452-44ca-8c07-7e70ca1e58e0",
    "title": "2 Miliardë për Bizneset",
    "statement": "A duhet shteti të ofroje 2 miliardë euro si kredi dhe garanci përbizneset për rritjen e investimeve dhe prodhimin vendas?",
    "detail": "",
    "tags": []
  },
  {
    "id": "84f02656-69c3-4631-9f6c-8e938b271714",
    "title": "Pa Kontrolle për Bizneset e Reja",
    "statement": "A duhet Shqipëria të ndalojë kontrollet shtetërore tek bizneset e reja për 3 vitet e para?",
    "detail": "",
    "tags": []
  },
  {
    "id": "9e28509c-a4f1-4539-8289-ac80f92c9c2a",
    "title": "Bashkëpronësi Industriale",
    "statement": "A duhet shteti të jetë bashkëpronar me % më të lartë në fushat kryesore të industrisë?",
    "detail": "",
    "tags": []
  },
  {
    "id": "b1f209f1-a4fb-4b63-b55b-ee400df114e5",
    "title": "Forcimi i Kodit për Sigurinë Ushqimore",
    "statement": "A duhet Shqipëria të forcojë Kodin Penal për shkelje të sigurisë ushqimore deri në masën e konfiskimit të biznesit?",
    "detail": "",
    "tags": []
  },
  {
    "id": "b7458383-f428-4baa-8b77-16815c908253",
    "title": "Praktika të Pagura për Studentët",
    "statement": "A duhet Shqipëria të ofrojë praktika pune të paguara për studentët?",
    "detail": "",
    "tags": []
  },
  {
    "id": "6ddddc0b-c16f-495f-88a1-d638ad96f6ec",
    "title": "Statusi i Minatorit",
    "statement": "A duhet Shqipëria të miratojë statusin e minatorit?",
    "detail": "",
    "tags": []
  },
  {
    "id": "25da7218-54d7-441a-a3d5-1babab4a244d",
    "title": "600€ për Fëmijët",
    "statement": "A duhet Shqipëria të japë 600 euro në vit për çdo fëmijë deri në 14 vjeç për familjet me të ardhura nën mesatare?",
    "detail": "",
    "tags": []
  },
  {
    "id": "61ab1f96-cc0a-44d2-abeb-d677da765432",
    "title": "Ligji për Referendumet",
    "statement": "A duhet Shqipëria të miratojë ligjin për referendumet për të lejuar qytetarët të vendosin drejtpërdrejt për ccështje të caktuara?",
    "detail": "",
    "tags": []
  },
  {
    "id": "0b95d60e-3a33-4dd5-b2e0-2f818d94e4b7",
    "title": "Transport Publik për Nxënësit",
    "statement": "A duhet Shqipëria të krijojë një kompani shtetërore të transportit publik për shkollat për të ccuar në shkollë dhe në shtëpi nxënësit?",
    "detail": "",
    "tags": []
  },
  {
    "id": "b9fb1709-6358-4adf-85ad-dc9ec7a55e29",
    "title": "Adoptimi i Euros",
    "statement": "A duhet Shqipëria të adoptojë euron si monedhën e saj duke hequr lekun?",
    "detail": "",
    "tags": []
  }
]