[
  {
    "id": "db7ac818-effe-4bc7-ba9c-1798e6649da7",
    "title": "Slovensko a klimatické zmeny",
    "statement": "Slovensko má robiť proti klimatickým zmenám viac ako teraz.",
    "tags": [
      "životné prostredie"
    ]
  },
  {
    "id": "e1850f01-4023-4bc2-bc01-e0d8853f0e2b",
    "title": "Vyššia daň za prázdne byty",
    "statement": "Dlhodobo prázdne byty by mali byť viac zdanené.",
    "tags": [
      "bývanie"
    ]
  },
  {
    "id": "f3e7a5b8-e37a-4869-9674-22c2cff4cb82",
    "title": "Slovensko mimo EU",
    "statement": "Slovensko by malo vystúpiť z EÚ.",
    "tags": [
      "diplomácia"
    ]
  },
  {
    "id": "66fa5905-6513-4d80-bbb6-7897f0c3b465",
    "title": "Školné na VŠ",
    "statement": "Na verejných vysokých školách by sa malo platiť školné.",
    "tags": [
      "vzdelávanie"
    ]
  },
  {
    "id": "7d30b158-c981-4838-a3f8-ee5eeac86d18",
    "title": "Hlasovanie cez internet",
    "statement": "Mala by sa zaviesť možnosť voliť cez internet.",
    "tags": [
      "demokrácia"
    ]
  },
  {
    "id": "5b15f407-fd1b-4fbe-9a20-bf975a126499",
    "title": "Zákaz automatického rozpoznávania tváre",
    "statement": "Používanie systémov automatického rozpoznávania tváre na verejných miestach by malo byť zakázané.",
    "detail": "Systémy na rozpoznávanie tváre využívajúce umelú inteligenciu môžu okrem iného prostredníctvom kamier sledovať jednotlivých ľudí na verejnosti.",
    "tags": [
      "ochrana súkromia"
    ]
  },
  {
    "id": "07225905-b95c-4e39-afaf-c51d0a631453",
    "title": "Legálne pestovanie konope",
    "statement": "Pestovanie konope (marihuany) na osobné použitie by malo byť legálne.",
    "tags": [
      "právo"
    ]
  },
  {
    "id": "744b7d88-fcc9-40cd-96b0-1f33b53ca6f2",
    "title": "Zákaz interrupcie",
    "statement": "Interrupcia by mala byť zakázaná až na výnimočné prípady, ako je znásilnenie alebo ohrozenie života matky.",
    "tags": [
      "rodina"
    ]
  },
  {
    "id": "0a915a97-2c29-4b3c-afe4-3b7510bcbfe3",
    "title": "Registrované partnerstvo",
    "statement": "Homosexuálne páry by mali mať možnost uzavrieť registrované partnerstvo.",
    "tags": [
      "rodina"
    ]
  },
  {
    "id": "45de98e3-1e94-4366-8f46-8378e3e69268",
    "title": "Výber pohlavia dieťaťa",
    "statement": "Rodičia v SR by mali mať možnosť vybrať si pohlavie dieťaťa pri umelom oplodnení.",
    "detail": "Slovensko podpísalo Oviedsku zmluvu o ľudských právach a biomedicíne. Táto medzinárodná zmluva okrem iného zakazuje výber pohlavia dieťaťa pri umelom oplodnení (s výnimkou niektorých preukázaných dedičných porúch). Výber pohlavia dieťaťa je nezákonný vo väčšine krajín sveta s výnimkou USA.",
    "tags": [
      "rodina"
    ]
  },
  {
    "id": "6f5dc0ee-308f-4799-b96e-2e05ca058041",
    "title": "Zodpovednosť sociálnych sietí",
    "statement": "Sociálne siete by mali byť zodpovedné za obsah, ktorý sprístupňujú.",
    "detail": "Veľké sociálne siete ako Facebook alebo Youtube sú dnes koncipované skôr ako nástenky: zodpovednosť (vrátane trestnoprávnej) za zverejnený obsah nesie predovšetkým osoba, ktorá obsah na sieť nahrala. Naopak, napríklad médiá sú zodpovedné za každý obsah, ktorý zverejnia.",
    "tags": [
      "média"
    ]
  },
  {
    "id": "4639ba79-463e-4c19-974e-f0509ff92aaa",
    "title": "Zvýšenie dane z alkoholu",
    "statement": "Spotrebná daň z alkoholu by sa mala zvýšiť.",
    "tags": [
      "ekonomika"
    ]
  },
  {
    "id": "f3482887-4800-4683-9afb-fb6dbb37e73e",
    "title": "Maloletí (zákaz reklamy)",
    "statement": "Reklama zameraná na deti by mala byť zakázaná.",
    "tags": [
      "spoločnosť"
    ]
  },
  {
    "id": "a6ba8152-b7bf-4c20-a337-d80c2dad9347",
    "title": "Dostupnosť psychoterapie",
    "statement": "Psychoterapia by mala byť štandardne hradená zo zdravotného poistenia.",
    "detail": "Dostupnosť psychoterapie je na Slovensku vo všeobecnosti nízka, dopyt je vysoký a čakacie lehoty sú neraz dlhé. A jej ceny určuje aj trh. Je možné absolvovať psychoterapiu hradenú z poistenia, ak ide o zdravotne indikovaný výkon – teda že pacient má diagnózu, ktorú možno efektívne ovplyvniť psychoterapiou.",
    "tags": [
      "zdravotníctvo"
    ]
  },
  {
    "id": "992f35be-e51e-4baa-a4f9-a009a9de5141",
    "title": "Očkovanie dobrovoľné",
    "statement": "Očkovanie by malo byť vždy dobrovoľné.",
    "tags": [
      "zdravotníctvo"
    ]
  },
  {
    "id": "f110a370-bf2b-41a9-a790-dc9733e2ebd5",
    "title": "Lekárske VŠ",
    "statement": "Absolventi lekárskych VŠ majú mať povinnosť niekoľko rokov pracovať na Slovensku, inak by museli doplatiť školné.",
    "tags": [
      "vzdelávanie"
    ]
  },
  {
    "id": "5939bbe8-70d8-43c5-8478-b6e5c2584f66",
    "title": "Vyššia DPH na škodlivé potraviny",
    "statement": "Zdraviu škodlivé potraviny (napr. malinovky, cukrovinky či hranolky) by mali mať vyššiu sadzbu DPH.",
    "tags": [
      "zdravotníctvo"
    ]
  },
  {
    "id": "8bcaec5d-a64b-40b3-b43d-c810c94d2c10",
    "title": "Ratifikácia Istanbulského dohovora",
    "statement": "Slovensko by malo ratifikovať Istanbulský dohovor.",
    "detail": "Ide o Dohovor Rady Európy o predchádzaní násiliu na ženách a domácemu násiliu. Okrem Slovenska zmluvu neratifikovali Česká republika, Maďarsko, Bulharsko, Litva, Lotyšsko a Arménsko. Azerbajdžan ju ani nepodpísal.",
    "tags": [
      "spoločnosť"
    ]
  },
  {
    "id": "d755713e-24df-4a1d-a606-7430815c4f8a",
    "title": "Podpora jadrovej energetiky",
    "statement": "Jadrová energetika by mala byť podporovaná z verejných zdrojov.",
    "detail": "Viac ako polovicu elektrickej energie (55 %) vyrába Slovensko v jadrových elektrárňach. Jedinou ďalšou krajinou EÚ s viac ako polovicou elektriny vyrobenej v jadrových elektrárňach je Francúzsko (67 % všetkej elektriny vyrobenej v krajine). V Nemecku a Rakúsku je to 0 %, v Holandsku 3 %. V Česku 37 %, v Maďarsku 46 %. Vo Španielsku 22 %, Švédsku 30 %, Fínsku 34 %.",
    "tags": [
      "životné prostredie"
    ]
  },
  {
    "id": "5cf42b4e-c3af-4711-a665-404b7185b5e0",
    "title": "Národné parky - rozšírenie bezzásahových zón",
    "statement": "Súhlasím s rozšírením bezzásahových zón s najvyšším stupňom ochrany v národných parkoch.",
    "detail": "Slovensko má deväť národných parkov a tretina z nich je dnes zazónovaná (Muránska planina, Slovenský raj, Pieninský národný park). Podľa súčasne platného zákona mali bezzásahové zóny dosahovať 50 percent plochy parkov. V roke 2011 bol plán, že bezzásahové zóny budú v roce 2030 zaberať 3/4 plochy parkov.",
    "tags": [
      "životné prostredie"
    ]
  },
  {
    "id": "bcf92117-efa2-435a-b459-9ed2f5e3d87e",
    "title": "Dvojí štátne občianstvo",
    "statement": "Súhlasím s tým, aby si ľudia, ktorí prijali občianstvo iného štátu, mohli nechať slovenské občianstvo.",
    "tags": [
      "demokrácia"
    ]
  },
  {
    "id": "b12c4cf4-0c5c-43b2-899b-d1b778e442f3",
    "title": "Kolonizácia Marsu",
    "statement": "Slovensko by sa malo viac zapojiť do úsilia o kolonizáciu Marsu.",
    "detail": "V súčasnosti sú na Marse 3 robotické prieskumné vozidlá (2 x NASA, 1 x Čína). 7 satelitov obieha okolo Marsu, z toho 2 európske. USA plánujú do 10 rokov letieť na Mars s ľuďmi a podobné programy majú aj Spojené arabské emiráty a Čína. Fyzik Stephen Hawking v roku 2017 predpovedal, že ľudstvo si musí v priebehu niekoľkých storočí nájsť domov mimo Zeme kvôli rizikám, ako sú zmena klímy, znečistenie, pandémie spôsobené novým vírusom, nezvládnutá umelá inteligencia a rast populácie.",
    "tags": [
      "spoločnosť"
    ]
  },
  {
    "id": "2a97a71f-a594-430b-8b2d-ee71fdd9a114",
    "title": "Skrátenie pracovnej doby",
    "statement": "Podporujem prijatie zákona, ktorý skráti pracovný čas zamestnancov.",
    "detail": "Všeobecne platí, že pracovný čas zamestnanca je najviac 40 hodín týždenne. Priemerný týždenný pracovný čas zamestnanca vrátane práce nadčas nesmie prekročiť 48 hodín.",
    "tags": [
      "ekonomika"
    ]
  },
  {
    "id": "562c7de1-6e2b-4a59-8f23-beb88b0f0a04",
    "title": "Slovensko mimo NATO",
    "statement": "Slovensko by malo vystúpiť z NATO.",
    "tags": [
      "diplomácia"
    ]
  },
  {
    "id": "cdd039f1-1bbf-4e25-a935-5ad2e328c601",
    "title": "Regulačný lov medveďov",
    "statement": "Ste za regulačný lov medveďov?",
    "detail": "Podľa odborníkov medveď hnedý stráca svoju plachosť. Časť politikov sľubuje likvidáciu \"ľudožrúta\" a poľovníci tvrdia, že lov je jediným spôsobom, ako útoky medveďov na ľudí zastaviť. Podľa kritikov viedol v minulosti povolený lov k odstrelu medveďov, ktoré neútočili na ľudí a slúžil najmä na zábavu a biznis. Podľa dostupných údajov sa počet medveďov za posledných 20 rokov nezvýšil.",
    "tags": [
      "životné prostredie"
    ]
  }
]